{
  "$schema": "https://json-schema.org/draft/2020-12/schema",
  "$id": "https://wasmagent.dev/schemas/aep/checkpoint-evidence.schema.json",
  "title": "CheckpointEvidence",
  "description": "Signed checkpoint/fork record — attests that a run's state was checkpointed (and optionally forked from a parent run), enabling verifiable resume and branch provenance. Carries the AEP envelope fields (schema_version, created_at_ms) plus checkpoint-specific keys.",
  "type": "object",
  "required": [
    "schema_version",
    "created_at_ms",
    "checkpoint_id",
    "parent_run_id",
    "state_digest"
  ],
  "properties": {
    "schema_version": {
      "type": "string",
      "description": "Semver-like schema identifier, e.g. aep/v0.1"
    },
    "trace_id": {
      "type": "string",
      "description": "Optional correlation ID linking related evidence records"
    },
    "created_at_ms": {
      "type": "number",
      "description": "UTC epoch milliseconds when the record was created (checkpoint creation time)"
    },
    "checkpoint_id": {
      "type": "string",
      "description": "Unique identifier for this checkpoint"
    },
    "parent_run_id": {
      "type": "string",
      "description": "Identifier of the run this checkpoint was taken from"
    },
    "fork_of": {
      "type": [
        "string",
        "null"
      ],
      "description": "Checkpoint_id this run was forked from, or null if this is not a fork"
    },
    "state_digest": {
      "type": "string",
      "description": "Content digest of the checkpointed run state, for tamper-evident resume"
    },
    "signature": {
      "type": "object",
      "description": "Optional tamper-evident signature over the record content",
      "required": [
        "alg",
        "key_id",
        "sig"
      ],
      "properties": {
        "alg": {
          "type": "string",
          "description": "Signature algorithm, e.g. ed25519"
        },
        "key_id": {
          "type": "string",
          "description": "Identifier of the signing key"
        },
        "sig": {
          "type": "string",
          "description": "Base64-encoded signature bytes"
        }
      },
      "additionalProperties": false
    }
  },
  "additionalProperties": false
}
